{
  "claim": "Entity exhibits elevated chokepoint exposure under the reference scoring model.",
  "created_at": "2003-04-15T19:37:48Z",
  "entity": {
    "chokepoint_score": 0.370736,
    "country": "MX",
    "entity_id": "E0001",
    "entity_name": "ASTER JUNIPER",
    "shipment_count": 11,
    "total_value_usd": 611496.36
  },
  "evidence": [
    {
      "hs_code": "9013",
      "match_score": 0.3333333333333333,
      "match_status": "REVIEW",
      "ship_date": "2024-04-15",
      "shipment_id": "S000010",
      "value_usd": 73444.53
    },
    {
      "hs_code": "7601",
      "match_score": 0.3333333333333333,
      "match_status": "REVIEW",
      "ship_date": "2024-05-06",
      "shipment_id": "S000015",
      "value_usd": 89204.03
    },
    {
      "hs_code": "9013",
      "match_score": 0.3333333333333333,
      "match_status": "REVIEW",
      "ship_date": "2024-05-18",
      "shipment_id": "S000019",
      "value_usd": 68772.31
    },
    {
      "hs_code": "8504",
      "match_score": 0.3333333333333333,
      "match_status": "REVIEW",
      "ship_date": "2024-11-13",
      "shipment_id": "S000023",
      "value_usd": 46164.37
    },
    {
      "hs_code": "7601",
      "match_score": 0.3333333333333333,
      "match_status": "REVIEW",
      "ship_date": "2024-08-19",
      "shipment_id": "S000024",
      "value_usd": 10853.71
    }
  ],
  "hashes": {
    "packet": "53213ed2173b24f4c2864f0df21295961f260b477b91b8fa06e45c44218a760b"
  },
  "lineage": [
    "RESOLVE",
    "ANALYZE",
    "EXPORT"
  ],
  "packet_id": "packet-E0001",
  "review": {
    "reason": "at_least_one_low_confidence_match",
    "status": "REVIEW"
  },
  "run_id": "run-7ce26d58-0cf2",
  "schema_version": "1.0"
}
