{
  "claim": "Entity exhibits elevated chokepoint exposure under the reference scoring model.",
  "created_at": "2015-06-20T15:13:15Z",
  "entity": {
    "chokepoint_score": 0.570483,
    "country": "IN",
    "entity_id": "E0008",
    "entity_name": "BOREAL BOREAL",
    "shipment_count": 13,
    "total_value_usd": 634603.04
  },
  "evidence": [
    {
      "hs_code": "7601",
      "match_score": 0.5,
      "match_status": "REVIEW",
      "ship_date": "2024-07-25",
      "shipment_id": "S000003",
      "value_usd": 6411.05
    },
    {
      "hs_code": "8471",
      "match_score": 0.5,
      "match_status": "REVIEW",
      "ship_date": "2024-07-27",
      "shipment_id": "S000006",
      "value_usd": 10805.57
    },
    {
      "hs_code": "8471",
      "match_score": 0.5,
      "match_status": "REVIEW",
      "ship_date": "2024-02-25",
      "shipment_id": "S000011",
      "value_usd": 76214.09
    },
    {
      "hs_code": "8542",
      "match_score": 0.5,
      "match_status": "REVIEW",
      "ship_date": "2024-09-13",
      "shipment_id": "S000014",
      "value_usd": 6566.94
    },
    {
      "hs_code": "3004",
      "match_score": 0.5,
      "match_status": "REVIEW",
      "ship_date": "2024-10-26",
      "shipment_id": "S000018",
      "value_usd": 88838.38
    }
  ],
  "hashes": {
    "packet": "f9343c13cb97ce591e2ba0bb71bbc384b5a3d5021c2439ae0e2723edcfbdfc7e"
  },
  "lineage": [
    "RESOLVE",
    "ANALYZE",
    "EXPORT"
  ],
  "packet_id": "packet-E0008",
  "review": {
    "reason": "at_least_one_low_confidence_match",
    "status": "REVIEW"
  },
  "run_id": "run-7ce26d58-0cf2",
  "schema_version": "1.0"
}
