{
  "claim": "Entity exhibits elevated chokepoint exposure under the reference scoring model.",
  "created_at": "2014-09-17T05:15:04Z",
  "entity": {
    "chokepoint_score": 0.689728,
    "country": "BR",
    "entity_id": "E0002",
    "entity_name": "ECHELON COBALT",
    "shipment_count": 25,
    "total_value_usd": 1070444.58
  },
  "evidence": [
    {
      "hs_code": "8504",
      "match_score": 0.3333333333333333,
      "match_status": "REVIEW",
      "ship_date": "2024-07-14",
      "shipment_id": "S000001",
      "value_usd": 7743.63
    },
    {
      "hs_code": "8703",
      "match_score": 0.3333333333333333,
      "match_status": "REVIEW",
      "ship_date": "2024-06-07",
      "shipment_id": "S000002",
      "value_usd": 4249.57
    },
    {
      "hs_code": "8504",
      "match_score": 0.3333333333333333,
      "match_status": "REVIEW",
      "ship_date": "2024-05-24",
      "shipment_id": "S000004",
      "value_usd": 58210.29
    },
    {
      "hs_code": "8471",
      "match_score": 0.3333333333333333,
      "match_status": "REVIEW",
      "ship_date": "2024-02-22",
      "shipment_id": "S000005",
      "value_usd": 29460.93
    },
    {
      "hs_code": "8542",
      "match_score": 0.3333333333333333,
      "match_status": "REVIEW",
      "ship_date": "2024-08-13",
      "shipment_id": "S000007",
      "value_usd": 56936.83
    }
  ],
  "hashes": {
    "packet": "0a92ec76d6fba22f50eeb16ce7ce01c60abda60e91536de0adadfbcdcd4b4311"
  },
  "lineage": [
    "RESOLVE",
    "ANALYZE",
    "EXPORT"
  ],
  "packet_id": "packet-E0002",
  "review": {
    "reason": "at_least_one_low_confidence_match",
    "status": "REVIEW"
  },
  "run_id": "run-7ce26d58-0cf2",
  "schema_version": "1.0"
}
