{
  "claim": "Entity exhibits elevated chokepoint exposure under the reference scoring model.",
  "created_at": "2019-03-11T07:21:24Z",
  "entity": {
    "chokepoint_score": 0.484542,
    "country": "GB",
    "entity_id": "E0015",
    "entity_name": "HALCYON GOSSAMER",
    "shipment_count": 11,
    "total_value_usd": 544881.37
  },
  "evidence": [
    {
      "hs_code": "9013",
      "match_score": 1.0,
      "match_status": "MATCH",
      "ship_date": "2024-12-03",
      "shipment_id": "S000008",
      "value_usd": 47060.19
    },
    {
      "hs_code": "8542",
      "match_score": 1.0,
      "match_status": "MATCH",
      "ship_date": "2024-07-28",
      "shipment_id": "S000012",
      "value_usd": 76957.09
    },
    {
      "hs_code": "8542",
      "match_score": 1.0,
      "match_status": "MATCH",
      "ship_date": "2024-03-20",
      "shipment_id": "S000016",
      "value_usd": 49869.3
    },
    {
      "hs_code": "3004",
      "match_score": 1.0,
      "match_status": "MATCH",
      "ship_date": "2024-06-01",
      "shipment_id": "S000021",
      "value_usd": 909.36
    },
    {
      "hs_code": "8542",
      "match_score": 1.0,
      "match_status": "MATCH",
      "ship_date": "2024-09-30",
      "shipment_id": "S000029",
      "value_usd": 14911.75
    }
  ],
  "hashes": {
    "packet": "5afe0837b931281860261a0272b4cbc8ebede2e5b3b41240261c7b32d3962b75"
  },
  "lineage": [
    "RESOLVE",
    "ANALYZE",
    "EXPORT"
  ],
  "packet_id": "packet-E0015",
  "review": {
    "reason": "sufficient_confidence",
    "status": "CLEAR"
  },
  "run_id": "run-7ce26d58-0cf2",
  "schema_version": "1.0"
}
